{
  "event_id": "s2-reg-nanjing-2026",
  "event_type": "other_official_event",
  "event_name": "Season 2 Regional: Nanjing",
  "region": null,
  "city": "Nanjing",
  "country": "China",
  "start_date": null,
  "end_date": null,
  "coverage_kind": "results",
  "placements": [
    {
      "place": 1,
      "player": "Ai.EDG.张伯伦",
      "legend": "Annie, Dark Child",
      "decklist_id": "s2_reg_nanjing_2026--annie,-dark-child-1"
    },
    {
      "place": 2,
      "player": "ConTRoL",
      "legend": "Azir, Emperor of the Sands",
      "decklist_id": "s2_reg_nanjing_2026--azir,-emperor-of-the-sands-2"
    },
    {
      "place": 3,
      "player": "土豆",
      "legend": "Draven, Glorious Executioner",
      "decklist_id": "s2_reg_nanjing_2026--draven,-glorious-executioner-3"
    },
    {
      "place": 4,
      "player": "淘金巢.Decade（恩师谷神）",
      "legend": "Irelia, Blade Dancer",
      "decklist_id": "s2_reg_nanjing_2026--irelia,-blade-dancer-4"
    },
    {
      "place": 5,
      "player": "淘金巢.Ai.ECG.极触感.乙酸盐",
      "legend": "Draven, Glorious Executioner",
      "decklist_id": "s2_reg_nanjing_2026--draven,-glorious-executioner-5"
    },
    {
      "place": 6,
      "player": "未中选所有区域公开赛中华人民共和国世界人民大团结巴勒斯坦抗战万岁",
      "legend": "Kai'Sa, Daughter of the Void",
      "decklist_id": "s2_reg_nanjing_2026--kai'sa,-daughter-of-the-void-6"
    },
    {
      "place": 7,
      "player": "東莞龙貓",
      "legend": "Draven, Glorious Executioner",
      "decklist_id": "s2_reg_nanjing_2026--draven,-glorious-executioner-7"
    },
    {
      "place": 8,
      "player": "VG.A1mer",
      "legend": "Irelia, Blade Dancer",
      "decklist_id": "s2_reg_nanjing_2026--irelia,-blade-dancer-8"
    }
  ],
  "best_of_legends": [],
  "source": {
    "source_type": "best_available",
    "source_name": "legacy_local_knowledge_db",
    "source_url": null,
    "source_date": "2026-03-06T10:11:31.039432Z",
    "retrieved_at": "2026-04-02",
    "trust_tier": "best_available",
    "notes": "upstream_path=/Users/eric/.openclaw/quarantine-20260323/old_openclaw_bak_03062026/workspace/databases/knowledge.db | upstream_status=reviewed"
  },
  "secondary_sources": [],
  "notes": "player_count=None | format=Spiritforged+Origins | decklist_count=8"
}
