{
  "event_id": "rq-bologna-2026",
  "event_type": "regional_qualifier",
  "event_name": "Regional Qualifier: Bologna",
  "region": null,
  "city": "Bologna",
  "country": "Italy",
  "start_date": "2026-02-20",
  "end_date": "2026-02-22",
  "coverage_kind": "results",
  "placements": [
    {
      "place": 1,
      "player": "Alanzq1",
      "legend": "Ezreal, Prodigal Explorer",
      "decklist_id": "rq_bologna_2026--ezreal,-prodigal-explorer-1"
    },
    {
      "place": 2,
      "player": "SEBIQQQQQQQQQQQQ",
      "legend": "Miss Fortune, Bounty Hunter",
      "decklist_id": "rq_bologna_2026--miss-fortune,-bounty-hunter-2"
    },
    {
      "place": 3,
      "player": "krowz",
      "legend": "Irelia, Blade Dancer",
      "decklist_id": "rq_bologna_2026--irelia,-blade-dancer-3"
    },
    {
      "place": 4,
      "player": "Ghosterdriver",
      "legend": "Viktor, Herald of the Arcane",
      "decklist_id": "rq_bologna_2026--viktor,-herald-of-the-arcane-4"
    },
    {
      "place": 5,
      "player": "Prismaticismism",
      "legend": "Draven, Glorious Executioner",
      "decklist_id": "rq_bologna_2026--draven,-glorious-executioner-5"
    },
    {
      "place": 6,
      "player": "Randyyy",
      "legend": "Draven, Glorious Executioner",
      "decklist_id": "rq_bologna_2026--draven,-glorious-executioner-6"
    },
    {
      "place": 7,
      "player": "M4rcus99",
      "legend": "Draven, Glorious Executioner",
      "decklist_id": "rq_bologna_2026--draven,-glorious-executioner-7"
    },
    {
      "place": 8,
      "player": "TheManLandRFT",
      "legend": "Ezreal, Prodigal Explorer",
      "decklist_id": "rq_bologna_2026--ezreal,-prodigal-explorer-8"
    },
    {
      "place": 9,
      "player": "fisica",
      "legend": "Kai'Sa, Daughter of the Void",
      "decklist_id": "rq_bologna_2026--kai'sa,-daughter-of-the-void-9"
    },
    {
      "place": 10,
      "player": "xTacio",
      "legend": "Sivir, Battle Mistress",
      "decklist_id": "rq_bologna_2026--sivir,-battle-mistress-10"
    },
    {
      "place": 13,
      "player": "wojtek",
      "legend": "Master Yi, Wuju Bladesman",
      "decklist_id": "rq_bologna_2026--master-yi,-wuju-bladesman-13"
    },
    {
      "place": 18,
      "player": "drinkmaker888",
      "legend": "Lucian, Purifier",
      "decklist_id": "rq_bologna_2026--lucian,-purifier-18"
    },
    {
      "place": 27,
      "player": "COPE Anarqhy",
      "legend": "Annie, Dark Child",
      "decklist_id": "rq_bologna_2026--annie,-dark-child-27"
    },
    {
      "place": 30,
      "player": "doctoreloki",
      "legend": "Volibear, Relentless Storm",
      "decklist_id": "rq_bologna_2026--volibear,-relentless-storm-30"
    },
    {
      "place": 35,
      "player": "Bubo",
      "legend": "Jax, Grandmaster at Arms",
      "decklist_id": "rq_bologna_2026--jax,-grandmaster-at-arms-35"
    },
    {
      "place": 37,
      "player": "digggi",
      "legend": "Jinx, Loose Cannon",
      "decklist_id": "rq_bologna_2026--jinx,-loose-cannon-37"
    },
    {
      "place": 48,
      "player": "Blunder",
      "legend": "Ahri, Nine-Tailed Fox",
      "decklist_id": "rq_bologna_2026--ahri,-nine-tailed-fox-48"
    },
    {
      "place": 50,
      "player": "Rocklho",
      "legend": "Azir, Emperor of the Sands",
      "decklist_id": "rq_bologna_2026--azir,-emperor-of-the-sands-50"
    },
    {
      "place": 53,
      "player": "Vendorty",
      "legend": "Fiora, Grand Duelist",
      "decklist_id": "rq_bologna_2026--fiora,-grand-duelist-53"
    },
    {
      "place": 71,
      "player": "Specimen",
      "legend": "Teemo, Swift Scout",
      "decklist_id": "rq_bologna_2026--teemo,-swift-scout-71"
    },
    {
      "place": 92,
      "player": "Luigi Amato TCG",
      "legend": "Yasuo, Unforgiven",
      "decklist_id": "rq_bologna_2026--yasuo,-unforgiven-92"
    },
    {
      "place": 93,
      "player": "NachoTCG",
      "legend": "Rumble, Mechanized Menace",
      "decklist_id": "rq_bologna_2026--rumble,-mechanized-menace-93"
    },
    {
      "place": 96,
      "player": "NLV Tomino",
      "legend": "Sett, The Boss",
      "decklist_id": "rq_bologna_2026--sett,-the-boss-96"
    },
    {
      "place": 98,
      "player": "Bulat",
      "legend": "Rek'Sai, Void Burrower",
      "decklist_id": "rq_bologna_2026--rek'sai,-void-burrower-98"
    },
    {
      "place": 104,
      "player": "Ochman",
      "legend": "Lux, Lady of Luminosity",
      "decklist_id": "rq_bologna_2026--lux,-lady-of-luminosity-104"
    },
    {
      "place": 116,
      "player": "Asefron29",
      "legend": "Darius, Hand of Noxus",
      "decklist_id": "rq_bologna_2026--darius,-hand-of-noxus-116"
    },
    {
      "place": 162,
      "player": "BoxingringxD",
      "legend": "Lee Sin, Blind Monk",
      "decklist_id": "rq_bologna_2026--lee-sin,-blind-monk-162"
    },
    {
      "place": 183,
      "player": "JustSR",
      "legend": "Renata Glasc, Chem-Baroness",
      "decklist_id": "rq_bologna_2026--renata-glasc,-chem-baroness-183"
    },
    {
      "place": 320,
      "player": "Daakkotah97",
      "legend": "Leona, Radiant Dawn",
      "decklist_id": "rq_bologna_2026--leona,-radiant-dawn-320"
    },
    {
      "place": 403,
      "player": "RiftboundTee",
      "legend": "Garen, Might of Demacia",
      "decklist_id": "rq_bologna_2026--garen,-might-of-demacia-403"
    },
    {
      "place": 490,
      "player": "GhostfunkLegend",
      "legend": "Ornn, the Fire Below the Mountain",
      "decklist_id": "rq_bologna_2026--ornn,-the-fire-below-the-mountain-490"
    }
  ],
  "best_of_legends": [
    "Kai'Sa, Daughter of the Void",
    "Sivir, Battle Mistress",
    "Master Yi, Wuju Bladesman",
    "Lucian, Purifier",
    "Annie, Dark Child",
    "Volibear, Relentless Storm",
    "Jax, Grandmaster at Arms",
    "Jinx, Loose Cannon",
    "Ahri, Nine-Tailed Fox",
    "Azir, Emperor of the Sands",
    "Fiora, Grand Duelist",
    "Teemo, Swift Scout",
    "Yasuo, Unforgiven",
    "Rumble, Mechanized Menace",
    "Sett, The Boss",
    "Rek'Sai, Void Burrower",
    "Lux, Lady of Luminosity",
    "Darius, Hand of Noxus",
    "Lee Sin, Blind Monk",
    "Renata Glasc, Chem-Baroness",
    "Leona, Radiant Dawn",
    "Garen, Might of Demacia",
    "Ornn, the Fire Below the Mountain"
  ],
  "source": {
    "source_type": "best_available",
    "source_name": "legacy_local_knowledge_db",
    "source_url": null,
    "source_date": "2026-03-06T10:11:31.039432Z",
    "retrieved_at": "2026-04-02",
    "trust_tier": "best_available",
    "notes": "upstream_path=/Users/eric/.openclaw/quarantine-20260323/old_openclaw_bak_03062026/workspace/databases/knowledge.db | upstream_status=reviewed"
  },
  "secondary_sources": [],
  "notes": "player_count=1719 | format=Spiritforged+Origins | decklist_count=31"
}
